superiotool r4.9-1107-g905d77d6f5
Found SMSC SCH5545 (id=0xc4, rev=0x01) at 0x2e
LDN 0x00 (Mailbox)
idx   val    def
0x30: 0x00   (0x00)
0xf0: 0x00   (0x00)

LDN 0x01 (KBC)
idx   val    def
0x30: 0x01   (0x00)
0xf0: 0x00   (0x00)

LDN 0x07 (COM1)
idx   val    def
0x30: 0x01   (0x00)
0xf0: 0x02   (0x00)

LDN 0x08 (COM2)
idx   val    def
0x30: 0x00   (0x00)
0xf0: 0x02   (0x00)

LDN 0x0a (RT)
idx   val    def
0x30: 0x00   (0x00)
0xf0: 0x00   (0x00)

LDN 0x0b (FDC)
idx   val    def
0x30: 0x00   (0x00)
0xf0: 0x0e   (0x00)

LDN 0x11 (PARALLEL PORT)
idx   val    def
0x30: 0x01   (0x00)
0xf0: 0x3b   (0x00)

LDN 0x3f (CONFIG PORT)
idx   val    def
0x30: 0x00   (0x00)
0xf0: 0x00   (0x00)

LDN 0x0c (LPC Interface)
idx   val    def
0x30: 0x01
0x40: 0xff
0x41: 0x01
0x42: 0x80
0x43: 0xff
0x44: 0x07
0x45: 0xff
0x46: 0xff
0x47: 0x11
0x48: 0xff
0x49: 0xff
0x4a: 0xff
0x4b: 0xff
0x4c: 0x81
0x4d: 0xff
0x4e: 0xff
0x4f: 0xff
0x50: 0x00
0x51: 0x00
0x52: 0x00
0x53: 0x00
0x54: 0x00
0x55: 0x00
0x56: 0x00
0x57: 0x00
0x58: 0x00
0x59: 0x00
0x5a: 0x00
0x5b: 0x00
0x5c: 0x00
0x5d: 0x00
0x5e: 0x00
0x5f: 0x00
0x60: 0x01
0x61: 0x8c
0x62: 0x2e
0x63: 0x00
0x64: 0x0f
0x65: 0x80
0x66: 0xd0
0x67: 0x02
0x68: 0x07
0x69: 0x87
0x6a: 0xf8
0x6b: 0x03
0x6c: 0x07
0x6d: 0x08
0x6e: 0x00
0x6f: 0x00
0x70: 0x3f
0x71: 0x8a
0x72: 0x80
0x73: 0x06
0x78: 0x00
0x79: 0x80
0x7a: 0x60
0x7b: 0x00
0x7c: 0x00
0x7d: 0x00
0x7e: 0x00
0x7f: 0x00
0x80: 0x00
0x81: 0x80
0x82: 0x78
0x83: 0x03

Dumping 52 I/O mapped registers at base 0x0680:
00 01 02 03 04 05 06 07 08 09 0a 0b 0c 0d 0e 0f 10 11 12 13 14 15 16 17 18 19 1a 1b 1c 1d 1e 1f 20 21 22 23 24 25 26 27 28 29 2a 2b 2c 2d 2e 2f 30 31 32 33 
00 00 18 61 00 00 00 00 00 00 00 00 00 00 00 00 00 01 03 14 00 40 40 40 00 00 00 00 00 00 00 00 03 02 02 02 00 0f 00 f1 15 00 ff 00 00 00 00 00 00 00 00 00 
